<?xml version="1.0"?>
<?xml-stylesheet type="text/xsl" href="../../xml/xtcHTML.xsl"?>
<problem xmlns:xsi="http://www.w3.org/2001/XMLSchema-instance" xsi:noNamespaceSchemaLocation="../../xml/xtc.xsd" type="termination">
<trs>
<rules>
<rule>
<lhs>
<funapp>
<name>if</name>
<arg>
<funapp>
<name>true</name>
</funapp>
</arg>
<arg>
<var>X</var>
</arg>
<arg>
<var>Y</var>
</arg>
</funapp>
</lhs>
<rhs>
<var>X</var>
</rhs>
</rule>
<rule>
<lhs>
<funapp>
<name>if</name>
<arg>
<funapp>
<name>false</name>
</funapp>
</arg>
<arg>
<var>X</var>
</arg>
<arg>
<var>Y</var>
</arg>
</funapp>
</lhs>
<rhs>
<var>Y</var>
</rhs>
</rule>
<rule>
<lhs>
<funapp>
<name>lteq</name>
<arg>
<funapp>
<name>s</name>
<arg>
<var>M</var>
</arg>
</funapp>
</arg>
<arg>
<funapp>
<name>o</name>
</funapp>
</arg>
</funapp>
</lhs>
<rhs>
<funapp>
<name>false</name>
</funapp>
</rhs>
</rule>
<rule>
<lhs>
<funapp>
<name>lteq</name>
<arg>
<funapp>
<name>o</name>
</funapp>
</arg>
<arg>
<var>M</var>
</arg>
</funapp>
</lhs>
<rhs>
<funapp>
<name>true</name>
</funapp>
</rhs>
</rule>
<rule>
<lhs>
<funapp>
<name>lteq</name>
<arg>
<funapp>
<name>s</name>
<arg>
<var>M</var>
</arg>
</funapp>
</arg>
<arg>
<funapp>
<name>s</name>
<arg>
<var>K</var>
</arg>
</funapp>
</arg>
</funapp>
</lhs>
<rhs>
<funapp>
<name>lteq</name>
<arg>
<var>M</var>
</arg>
<arg>
<var>K</var>
</arg>
</funapp>
</rhs>
</rule>
<rule>
<lhs>
<funapp>
<name>from</name>
<arg>
<var>M</var>
</arg>
<arg>
<funapp>
<name>nil</name>
</funapp>
</arg>
</funapp>
</lhs>
<rhs>
<funapp>
<name>nil</name>
</funapp>
</rhs>
</rule>
<rule>
<lhs>
<funapp>
<name>from</name>
<arg>
<var>M</var>
</arg>
<arg>
<funapp>
<name>cons</name>
<arg>
<var>H</var>
</arg>
<arg>
<var>Z</var>
</arg>
</funapp>
</arg>
</funapp>
</lhs>
<rhs>
<funapp>
<name>if</name>
<arg>
<funapp>
<name>lteq</name>
<arg>
<var>M</var>
</arg>
<arg>
<var>H</var>
</arg>
</funapp>
</arg>
<arg>
<funapp>
<name>cons</name>
<arg>
<var>H</var>
</arg>
<arg>
<var>Z</var>
</arg>
</funapp>
</arg>
<arg>
<funapp>
<name>from</name>
<arg>
<var>M</var>
</arg>
<arg>
<var>Z</var>
</arg>
</funapp>
</arg>
</funapp>
</rhs>
</rule>
<rule>
<lhs>
<funapp>
<name>chain</name>
<arg>
<var>F</var>
</arg>
<arg>
<funapp>
<name>nil</name>
</funapp>
</arg>
</funapp>
</lhs>
<rhs>
<funapp>
<name>nil</name>
</funapp>
</rhs>
</rule>
<rule>
<lhs>
<funapp>
<name>chain</name>
<arg>
<var>F</var>
</arg>
<arg>
<funapp>
<name>cons</name>
<arg>
<var>H</var>
</arg>
<arg>
<var>Z</var>
</arg>
</funapp>
</arg>
</funapp>
</lhs>
<rhs>
<funapp>
<name>cons</name>
<arg>
<application>
<var>F</var>
<var>H</var>
</application>
</arg>
<arg>
<funapp>
<name>chain</name>
<arg>
<var>F</var>
</arg>
<arg>
<funapp>
<name>from</name>
<arg>
<application>
<var>F</var>
<var>H</var>
</application>
</arg>
<arg>
<var>Z</var>
</arg>
</funapp>
</arg>
</funapp>
</arg>
</funapp>
</rhs>
</rule>
<rule>
<lhs>
<funapp>
<name>incch</name>
<arg>
<var>X</var>
</arg>
</funapp>
</lhs>
<rhs>
<funapp>
<name>chain</name>
<arg>
<lambda>
<var>x</var>
<type>
<basic>N</basic>
</type>
<funapp>
<name>s</name>
<arg>
<var>x</var>
</arg>
</funapp>
</lambda>
</arg>
<arg>
<var>X</var>
</arg>
</funapp>
</rhs>
</rule>
</rules>
<higherOrderSignature>
<variableTypeInfo>
<varDeclaration>
<var>X</var>
<type>
<basic>list</basic>
</type>
</varDeclaration>
<varDeclaration>
<var>Y</var>
<type>
<basic>list</basic>
</type>
</varDeclaration>
<varDeclaration>
<var>Z</var>
<type>
<basic>list</basic>
</type>
</varDeclaration>
<varDeclaration>
<var>M</var>
<type>
<basic>N</basic>
</type>
</varDeclaration>
<varDeclaration>
<var>K</var>
<type>
<basic>N</basic>
</type>
</varDeclaration>
<varDeclaration>
<var>H</var>
<type>
<basic>N</basic>
</type>
</varDeclaration>
<varDeclaration>
<var>F</var>
<type>
<arrow>
<type>
<basic>N</basic>
</type>
<type>
<basic>N</basic>
</type>
</arrow>
</type>
</varDeclaration>
</variableTypeInfo>
<functionSymbolTypeInfo>
<funcDeclaration>
<name>o</name>
<typeDeclaration>
<type>
<basic>N</basic>
</type>
</typeDeclaration>
</funcDeclaration>
<funcDeclaration>
<name>s</name>
<typeDeclaration>
<type>
<basic>N</basic>
</type>
<type>
<basic>N</basic>
</type>
</typeDeclaration>
</funcDeclaration>
<funcDeclaration>
<name>true</name>
<typeDeclaration>
<type>
<basic>B</basic>
</type>
</typeDeclaration>
</funcDeclaration>
<funcDeclaration>
<name>false</name>
<typeDeclaration>
<type>
<basic>B</basic>
</type>
</typeDeclaration>
</funcDeclaration>
<funcDeclaration>
<name>nil</name>
<typeDeclaration>
<type>
<basic>list</basic>
</type>
</typeDeclaration>
</funcDeclaration>
<funcDeclaration>
<name>cons</name>
<typeDeclaration>
<type>
<basic>N</basic>
</type>
<type>
<basic>list</basic>
</type>
<type>
<basic>list</basic>
</type>
</typeDeclaration>
</funcDeclaration>
<funcDeclaration>
<name>if</name>
<typeDeclaration>
<type>
<basic>B</basic>
</type>
<type>
<basic>list</basic>
</type>
<type>
<basic>list</basic>
</type>
<type>
<basic>list</basic>
</type>
</typeDeclaration>
</funcDeclaration>
<funcDeclaration>
<name>lteq</name>
<typeDeclaration>
<type>
<basic>N</basic>
</type>
<type>
<basic>N</basic>
</type>
<type>
<basic>B</basic>
</type>
</typeDeclaration>
</funcDeclaration>
<funcDeclaration>
<name>from</name>
<typeDeclaration>
<type>
<basic>N</basic>
</type>
<type>
<basic>list</basic>
</type>
<type>
<basic>list</basic>
</type>
</typeDeclaration>
</funcDeclaration>
<funcDeclaration>
<name>chain</name>
<typeDeclaration>
<type>
<arrow>
<type>
<basic>N</basic>
</type>
<type>
<basic>N</basic>
</type>
</arrow>
</type>
<type>
<basic>list</basic>
</type>
<type>
<basic>list</basic>
</type>
</typeDeclaration>
</funcDeclaration>
<funcDeclaration>
<name>incch</name>
<typeDeclaration>
<type>
<basic>list</basic>
</type>
<type>
<basic>list</basic>
</type>
</typeDeclaration>
</funcDeclaration>
</functionSymbolTypeInfo>
</higherOrderSignature>
</trs>
<strategy>FULL</strategy>
<metainformation>
<originalfilename>.</originalfilename>
</metainformation>
</problem>
