<?xml version="1.0"?>
<?xml-stylesheet type="text/xsl" href="../../xml/xtcHTML.xsl"?>
<problem xmlns:xsi="http://www.w3.org/2001/XMLSchema-instance" xsi:noNamespaceSchemaLocation="../../xml/xtc.xsd" type="termination">
<trs>
<rules>
<rule>
<lhs>
<funapp>
<name>f</name>
<arg>
<funapp>
<name>g</name>
<arg>
<var>X</var>
</arg>
</funapp>
</arg>
<arg>
<funapp>
<name>g</name>
<arg>
<var>X</var>
</arg>
</funapp>
</arg>
</funapp>
</lhs>
<rhs>
<application>
<var>X</var>
<funapp>
<name>g</name>
<arg>
<var>X</var>
</arg>
</funapp>
</application>
</rhs>
</rule>
</rules>
<higherOrderSignature>
<variableTypeInfo>
<varDeclaration>
<var>X</var>
<type>
<arrow>
<type>
<basic>nat</basic>
</type>
<type>
<basic>nat</basic>
</type>
</arrow>
</type>
</varDeclaration>
</variableTypeInfo>
<functionSymbolTypeInfo>
<funcDeclaration>
<name>f</name>
<typeDeclaration>
<type>
<basic>nat</basic>
</type>
<type>
<basic>nat</basic>
</type>
<type>
<basic>nat</basic>
</type>
</typeDeclaration>
</funcDeclaration>
<funcDeclaration>
<name>g</name>
<typeDeclaration>
<type>
<arrow>
<type>
<basic>nat</basic>
</type>
<type>
<basic>nat</basic>
</type>
</arrow>
</type>
<type>
<basic>nat</basic>
</type>
</typeDeclaration>
</funcDeclaration>
</functionSymbolTypeInfo>
</higherOrderSignature>
</trs>
<strategy>FULL</strategy>
<metainformation>
<originalfilename>.</originalfilename>
</metainformation>
</problem>
