<?xml version="1.0"?>
<?xml-stylesheet type="text/xsl" href="../../xml/xtcHTML.xsl"?>
<problem xmlns:xsi="http://www.w3.org/2001/XMLSchema-instance" type="termination" xsi:noNamespaceSchemaLocation="../../xml/xtc.xsd">
<trs>
<rules>
<rule>
<lhs>
<funapp>
<name>gcd</name>
<arg>
<funapp>
<name>add</name>
<arg>
<var>x</var>
</arg>
<arg>
<var>y</var>
</arg>
</funapp>
</arg>
<arg>
<var>y</var>
</arg>
</funapp>
</lhs>
<rhs>
<funapp>
<name>gcd</name>
<arg>
<var>x</var>
</arg>
<arg>
<var>y</var>
</arg>
</funapp>
</rhs>
</rule>
<rule>
<lhs>
<funapp>
<name>gcd</name>
<arg>
<var>y</var>
</arg>
<arg>
<funapp>
<name>add</name>
<arg>
<var>x</var>
</arg>
<arg>
<var>y</var>
</arg>
</funapp>
</arg>
</funapp>
</lhs>
<rhs>
<funapp>
<name>gcd</name>
<arg>
<var>x</var>
</arg>
<arg>
<var>y</var>
</arg>
</funapp>
</rhs>
</rule>
<rule>
<lhs>
<funapp>
<name>gcd</name>
<arg>
<var>x</var>
</arg>
<arg>
<funapp>
<name>0</name>
</funapp>
</arg>
</funapp>
</lhs>
<rhs>
<var>x</var>
</rhs>
</rule>
<rule>
<lhs>
<funapp>
<name>gcd</name>
<arg>
<funapp>
<name>0</name>
</funapp>
</arg>
<arg>
<var>x</var>
</arg>
</funapp>
</lhs>
<rhs>
<var>x</var>
</rhs>
</rule>
<rule>
<lhs>
<funapp>
<name>add</name>
<arg>
<funapp>
<name>0</name>
</funapp>
</arg>
<arg>
<var>y</var>
</arg>
</funapp>
</lhs>
<rhs>
<var>y</var>
</rhs>
</rule>
<rule>
<lhs>
<funapp>
<name>add</name>
<arg>
<funapp>
<name>s</name>
<arg>
<var>x</var>
</arg>
</funapp>
</arg>
<arg>
<var>y</var>
</arg>
</funapp>
</lhs>
<rhs>
<funapp>
<name>s</name>
<arg>
<funapp>
<name>add</name>
<arg>
<var>x</var>
</arg>
<arg>
<var>y</var>
</arg>
</funapp>
</arg>
</funapp>
</rhs>
</rule>
<rule>
<lhs>
<funapp>
<name>gcd</name>
<arg>
<var>x</var>
</arg>
<arg>
<var>y</var>
</arg>
</funapp>
</lhs>
<rhs>
<funapp>
<name>gcd</name>
<arg>
<var>y</var>
</arg>
<arg>
<var>x</var>
</arg>
</funapp>
</rhs>
<conditions>
<condition>
<lhs>
<funapp>
<name>leq</name>
<arg>
<var>y</var>
</arg>
<arg>
<var>x</var>
</arg>
</funapp>
</lhs>
<rhs>
<funapp>
<name>false</name>
</funapp>
</rhs>
</condition>
</conditions>
</rule>
</rules>
<signature>
<funcsym>
<name>gcd</name>
<arity>2</arity>
</funcsym>
<funcsym>
<name>add</name>
<arity>2</arity>
</funcsym>
<funcsym>
<name>0</name>
<arity>0</arity>
</funcsym>
<funcsym>
<name>s</name>
<arity>1</arity>
</funcsym>
<funcsym>
<name>leq</name>
<arity>2</arity>
</funcsym>
<funcsym>
<name>false</name>
<arity>0</arity>
</funcsym>
</signature>
<conditiontype>ORIENTED</conditiontype>
</trs>
<strategy>FULL</strategy>
</problem>
