<?xml version="1.0" encoding="UTF-8"?>
<?xml-stylesheet type="text/xsl" href="../../xml/xtcHTML.xsl"?>
<problem xmlns:xsi="http://www.w3.org/2001/XMLSchema-instance" xsi:noNamespaceSchemaLocation="../../xml/xtc.xsd" type="complexity">
<trs>
<rules>
<rule>
<lhs>
<funapp>
<name>circ</name>
<arg>
<funapp>
<name>cons</name>
<arg>
<var>a</var>
</arg>
<arg>
<var>s</var>
</arg>
</funapp>
</arg>
<arg>
<var>t</var>
</arg>
</funapp>
</lhs>
<rhs>
<funapp>
<name>cons</name>
<arg>
<funapp>
<name>msubst</name>
<arg>
<var>a</var>
</arg>
<arg>
<var>t</var>
</arg>
</funapp>
</arg>
<arg>
<funapp>
<name>circ</name>
<arg>
<var>s</var>
</arg>
<arg>
<var>t</var>
</arg>
</funapp>
</arg>
</funapp>
</rhs>
</rule>
<rule>
<lhs>
<funapp>
<name>circ</name>
<arg>
<funapp>
<name>cons</name>
<arg>
<funapp>
<name>lift</name>
</funapp>
</arg>
<arg>
<var>s</var>
</arg>
</funapp>
</arg>
<arg>
<funapp>
<name>cons</name>
<arg>
<var>a</var>
</arg>
<arg>
<var>t</var>
</arg>
</funapp>
</arg>
</funapp>
</lhs>
<rhs>
<funapp>
<name>cons</name>
<arg>
<var>a</var>
</arg>
<arg>
<funapp>
<name>circ</name>
<arg>
<var>s</var>
</arg>
<arg>
<var>t</var>
</arg>
</funapp>
</arg>
</funapp>
</rhs>
</rule>
<rule>
<lhs>
<funapp>
<name>circ</name>
<arg>
<funapp>
<name>cons</name>
<arg>
<funapp>
<name>lift</name>
</funapp>
</arg>
<arg>
<var>s</var>
</arg>
</funapp>
</arg>
<arg>
<funapp>
<name>cons</name>
<arg>
<funapp>
<name>lift</name>
</funapp>
</arg>
<arg>
<var>t</var>
</arg>
</funapp>
</arg>
</funapp>
</lhs>
<rhs>
<funapp>
<name>cons</name>
<arg>
<funapp>
<name>lift</name>
</funapp>
</arg>
<arg>
<funapp>
<name>circ</name>
<arg>
<var>s</var>
</arg>
<arg>
<var>t</var>
</arg>
</funapp>
</arg>
</funapp>
</rhs>
</rule>
<rule>
<lhs>
<funapp>
<name>circ</name>
<arg>
<funapp>
<name>circ</name>
<arg>
<var>s</var>
</arg>
<arg>
<var>t</var>
</arg>
</funapp>
</arg>
<arg>
<var>u</var>
</arg>
</funapp>
</lhs>
<rhs>
<funapp>
<name>circ</name>
<arg>
<var>s</var>
</arg>
<arg>
<funapp>
<name>circ</name>
<arg>
<var>t</var>
</arg>
<arg>
<var>u</var>
</arg>
</funapp>
</arg>
</funapp>
</rhs>
</rule>
<rule>
<lhs>
<funapp>
<name>circ</name>
<arg>
<var>s</var>
</arg>
<arg>
<funapp>
<name>id</name>
</funapp>
</arg>
</funapp>
</lhs>
<rhs>
<var>s</var>
</rhs>
</rule>
<rule>
<lhs>
<funapp>
<name>circ</name>
<arg>
<funapp>
<name>id</name>
</funapp>
</arg>
<arg>
<var>s</var>
</arg>
</funapp>
</lhs>
<rhs>
<var>s</var>
</rhs>
</rule>
<rule>
<lhs>
<funapp>
<name>circ</name>
<arg>
<funapp>
<name>cons</name>
<arg>
<funapp>
<name>lift</name>
</funapp>
</arg>
<arg>
<var>s</var>
</arg>
</funapp>
</arg>
<arg>
<funapp>
<name>circ</name>
<arg>
<funapp>
<name>cons</name>
<arg>
<funapp>
<name>lift</name>
</funapp>
</arg>
<arg>
<var>t</var>
</arg>
</funapp>
</arg>
<arg>
<var>u</var>
</arg>
</funapp>
</arg>
</funapp>
</lhs>
<rhs>
<funapp>
<name>circ</name>
<arg>
<funapp>
<name>cons</name>
<arg>
<funapp>
<name>lift</name>
</funapp>
</arg>
<arg>
<funapp>
<name>circ</name>
<arg>
<var>s</var>
</arg>
<arg>
<var>t</var>
</arg>
</funapp>
</arg>
</funapp>
</arg>
<arg>
<var>u</var>
</arg>
</funapp>
</rhs>
</rule>
<rule>
<lhs>
<funapp>
<name>subst</name>
<arg>
<var>a</var>
</arg>
<arg>
<funapp>
<name>id</name>
</funapp>
</arg>
</funapp>
</lhs>
<rhs>
<var>a</var>
</rhs>
</rule>
<rule>
<lhs>
<funapp>
<name>msubst</name>
<arg>
<var>a</var>
</arg>
<arg>
<funapp>
<name>id</name>
</funapp>
</arg>
</funapp>
</lhs>
<rhs>
<var>a</var>
</rhs>
</rule>
<rule>
<lhs>
<funapp>
<name>msubst</name>
<arg>
<funapp>
<name>msubst</name>
<arg>
<var>a</var>
</arg>
<arg>
<var>s</var>
</arg>
</funapp>
</arg>
<arg>
<var>t</var>
</arg>
</funapp>
</lhs>
<rhs>
<funapp>
<name>msubst</name>
<arg>
<var>a</var>
</arg>
<arg>
<funapp>
<name>circ</name>
<arg>
<var>s</var>
</arg>
<arg>
<var>t</var>
</arg>
</funapp>
</arg>
</funapp>
</rhs>
</rule>
</rules>
<signature>
<funcsym>
<name>circ</name>
<arity>2</arity>
</funcsym>
<funcsym>
<name>cons</name>
<arity>2</arity>
</funcsym>
<funcsym>
<name>msubst</name>
<arity>2</arity>
</funcsym>
<funcsym>
<name>lift</name>
<arity>0</arity>
</funcsym>
<funcsym>
<name>id</name>
<arity>0</arity>
</funcsym>
<funcsym>
<name>subst</name>
<arity>2</arity>
</funcsym>
</signature>
</trs>
<strategy>INNERMOST</strategy>
<startterm>
<constructor-based/>
</startterm>
<metainformation>
<originalfilename>./TRS/secret05/cime2.trs</originalfilename>
</metainformation>
</problem>
