<?xml version="1.0" encoding="UTF-8"?>
<?xml-stylesheet type="text/xsl" href="../../xml/xtcHTML.xsl"?>
<problem xmlns:xsi="http://www.w3.org/2001/XMLSchema-instance" xsi:noNamespaceSchemaLocation="../../xml/xtc.xsd" type="complexity">
<trs>
<rules>
<rule>
<lhs>
<funapp>
<name>r0</name>
<arg>
<funapp>
<name>0</name>
<arg>
<var>x1</var>
</arg>
</funapp>
</arg>
</funapp>
</lhs>
<rhs>
<funapp>
<name>0</name>
<arg>
<funapp>
<name>r0</name>
<arg>
<var>x1</var>
</arg>
</funapp>
</arg>
</funapp>
</rhs>
</rule>
<rule>
<lhs>
<funapp>
<name>r0</name>
<arg>
<funapp>
<name>1</name>
<arg>
<var>x1</var>
</arg>
</funapp>
</arg>
</funapp>
</lhs>
<rhs>
<funapp>
<name>1</name>
<arg>
<funapp>
<name>r0</name>
<arg>
<var>x1</var>
</arg>
</funapp>
</arg>
</funapp>
</rhs>
</rule>
<rule>
<lhs>
<funapp>
<name>r0</name>
<arg>
<funapp>
<name>m</name>
<arg>
<var>x1</var>
</arg>
</funapp>
</arg>
</funapp>
</lhs>
<rhs>
<funapp>
<name>m</name>
<arg>
<funapp>
<name>r0</name>
<arg>
<var>x1</var>
</arg>
</funapp>
</arg>
</funapp>
</rhs>
</rule>
<rule>
<lhs>
<funapp>
<name>r1</name>
<arg>
<funapp>
<name>0</name>
<arg>
<var>x1</var>
</arg>
</funapp>
</arg>
</funapp>
</lhs>
<rhs>
<funapp>
<name>0</name>
<arg>
<funapp>
<name>r1</name>
<arg>
<var>x1</var>
</arg>
</funapp>
</arg>
</funapp>
</rhs>
</rule>
<rule>
<lhs>
<funapp>
<name>r1</name>
<arg>
<funapp>
<name>1</name>
<arg>
<var>x1</var>
</arg>
</funapp>
</arg>
</funapp>
</lhs>
<rhs>
<funapp>
<name>1</name>
<arg>
<funapp>
<name>r1</name>
<arg>
<var>x1</var>
</arg>
</funapp>
</arg>
</funapp>
</rhs>
</rule>
<rule>
<lhs>
<funapp>
<name>r1</name>
<arg>
<funapp>
<name>m</name>
<arg>
<var>x1</var>
</arg>
</funapp>
</arg>
</funapp>
</lhs>
<rhs>
<funapp>
<name>m</name>
<arg>
<funapp>
<name>r1</name>
<arg>
<var>x1</var>
</arg>
</funapp>
</arg>
</funapp>
</rhs>
</rule>
<rule>
<lhs>
<funapp>
<name>r0</name>
<arg>
<funapp>
<name>b</name>
<arg>
<var>x1</var>
</arg>
</funapp>
</arg>
</funapp>
</lhs>
<rhs>
<funapp>
<name>qr</name>
<arg>
<funapp>
<name>0</name>
<arg>
<funapp>
<name>b</name>
<arg>
<var>x1</var>
</arg>
</funapp>
</arg>
</funapp>
</arg>
</funapp>
</rhs>
</rule>
<rule>
<lhs>
<funapp>
<name>r1</name>
<arg>
<funapp>
<name>b</name>
<arg>
<var>x1</var>
</arg>
</funapp>
</arg>
</funapp>
</lhs>
<rhs>
<funapp>
<name>qr</name>
<arg>
<funapp>
<name>1</name>
<arg>
<funapp>
<name>b</name>
<arg>
<var>x1</var>
</arg>
</funapp>
</arg>
</funapp>
</arg>
</funapp>
</rhs>
</rule>
<rule>
<lhs>
<funapp>
<name>0</name>
<arg>
<funapp>
<name>qr</name>
<arg>
<var>x1</var>
</arg>
</funapp>
</arg>
</funapp>
</lhs>
<rhs>
<funapp>
<name>qr</name>
<arg>
<funapp>
<name>0</name>
<arg>
<var>x1</var>
</arg>
</funapp>
</arg>
</funapp>
</rhs>
</rule>
<rule>
<lhs>
<funapp>
<name>1</name>
<arg>
<funapp>
<name>qr</name>
<arg>
<var>x1</var>
</arg>
</funapp>
</arg>
</funapp>
</lhs>
<rhs>
<funapp>
<name>qr</name>
<arg>
<funapp>
<name>1</name>
<arg>
<var>x1</var>
</arg>
</funapp>
</arg>
</funapp>
</rhs>
</rule>
<rule>
<lhs>
<funapp>
<name>m</name>
<arg>
<funapp>
<name>qr</name>
<arg>
<var>x1</var>
</arg>
</funapp>
</arg>
</funapp>
</lhs>
<rhs>
<funapp>
<name>ql</name>
<arg>
<funapp>
<name>m</name>
<arg>
<var>x1</var>
</arg>
</funapp>
</arg>
</funapp>
</rhs>
</rule>
<rule>
<lhs>
<funapp>
<name>0</name>
<arg>
<funapp>
<name>ql</name>
<arg>
<var>x1</var>
</arg>
</funapp>
</arg>
</funapp>
</lhs>
<rhs>
<funapp>
<name>ql</name>
<arg>
<funapp>
<name>0</name>
<arg>
<var>x1</var>
</arg>
</funapp>
</arg>
</funapp>
</rhs>
</rule>
<rule>
<lhs>
<funapp>
<name>1</name>
<arg>
<funapp>
<name>ql</name>
<arg>
<var>x1</var>
</arg>
</funapp>
</arg>
</funapp>
</lhs>
<rhs>
<funapp>
<name>ql</name>
<arg>
<funapp>
<name>1</name>
<arg>
<var>x1</var>
</arg>
</funapp>
</arg>
</funapp>
</rhs>
</rule>
<rule>
<lhs>
<funapp>
<name>b</name>
<arg>
<funapp>
<name>ql</name>
<arg>
<funapp>
<name>0</name>
<arg>
<var>x1</var>
</arg>
</funapp>
</arg>
</funapp>
</arg>
</funapp>
</lhs>
<rhs>
<funapp>
<name>0</name>
<arg>
<funapp>
<name>b</name>
<arg>
<funapp>
<name>r0</name>
<arg>
<var>x1</var>
</arg>
</funapp>
</arg>
</funapp>
</arg>
</funapp>
</rhs>
</rule>
<rule>
<lhs>
<funapp>
<name>b</name>
<arg>
<funapp>
<name>ql</name>
<arg>
<funapp>
<name>1</name>
<arg>
<var>x1</var>
</arg>
</funapp>
</arg>
</funapp>
</arg>
</funapp>
</lhs>
<rhs>
<funapp>
<name>1</name>
<arg>
<funapp>
<name>b</name>
<arg>
<funapp>
<name>r1</name>
<arg>
<var>x1</var>
</arg>
</funapp>
</arg>
</funapp>
</arg>
</funapp>
</rhs>
</rule>
</rules>
<signature>
<funcsym>
<name>r0</name>
<arity>1</arity>
</funcsym>
<funcsym>
<name>0</name>
<arity>1</arity>
</funcsym>
<funcsym>
<name>1</name>
<arity>1</arity>
</funcsym>
<funcsym>
<name>m</name>
<arity>1</arity>
</funcsym>
<funcsym>
<name>r1</name>
<arity>1</arity>
</funcsym>
<funcsym>
<name>b</name>
<arity>1</arity>
</funcsym>
<funcsym>
<name>qr</name>
<arity>1</arity>
</funcsym>
<funcsym>
<name>ql</name>
<arity>1</arity>
</funcsym>
</signature>
</trs>
<strategy>FULL</strategy>
<startterm>
<full/>
</startterm>
<metainformation>
<originalfilename>./SRS/Zantema/z091.srs</originalfilename>
</metainformation>
</problem>
