<?xml version="1.0"?>
<?xml-stylesheet type="text/xsl" href="../../xml/xtcHTML.xsl"?>
<problem xmlns:xsi="http://www.w3.org/2001/XMLSchema-instance" type="complexity" xsi:noNamespaceSchemaLocation="../../xml/xtc.xsd">
<trs>
<rules>
<rule>
<lhs>
<funapp>
<name>revconsapp</name>
<arg>
<funapp>
<name>C</name>
<arg>
<var>x1</var>
</arg>
<arg>
<var>x2</var>
</arg>
</funapp>
</arg>
<arg>
<var>r</var>
</arg>
</funapp>
</lhs>
<rhs>
<funapp>
<name>revconsapp</name>
<arg>
<var>x2</var>
</arg>
<arg>
<funapp>
<name>C</name>
<arg>
<var>x1</var>
</arg>
<arg>
<var>r</var>
</arg>
</funapp>
</arg>
</funapp>
</rhs>
</rule>
<rule>
<lhs>
<funapp>
<name>deeprevapp</name>
<arg>
<funapp>
<name>C</name>
<arg>
<var>x1</var>
</arg>
<arg>
<var>x2</var>
</arg>
</funapp>
</arg>
<arg>
<var>rest</var>
</arg>
</funapp>
</lhs>
<rhs>
<funapp>
<name>deeprevapp</name>
<arg>
<var>x2</var>
</arg>
<arg>
<funapp>
<name>C</name>
<arg>
<var>x1</var>
</arg>
<arg>
<var>rest</var>
</arg>
</funapp>
</arg>
</funapp>
</rhs>
</rule>
<rule>
<lhs>
<funapp>
<name>deeprevapp</name>
<arg>
<funapp>
<name>V</name>
<arg>
<var>n</var>
</arg>
</funapp>
</arg>
<arg>
<var>rest</var>
</arg>
</funapp>
</lhs>
<rhs>
<funapp>
<name>revconsapp</name>
<arg>
<var>rest</var>
</arg>
<arg>
<funapp>
<name>V</name>
<arg>
<var>n</var>
</arg>
</funapp>
</arg>
</funapp>
</rhs>
</rule>
<rule>
<lhs>
<funapp>
<name>deeprevapp</name>
<arg>
<funapp>
<name>N</name>
</funapp>
</arg>
<arg>
<var>rest</var>
</arg>
</funapp>
</lhs>
<rhs>
<var>rest</var>
</rhs>
</rule>
<rule>
<lhs>
<funapp>
<name>revconsapp</name>
<arg>
<funapp>
<name>V</name>
<arg>
<var>n</var>
</arg>
</funapp>
</arg>
<arg>
<var>r</var>
</arg>
</funapp>
</lhs>
<rhs>
<var>r</var>
</rhs>
</rule>
<rule>
<lhs>
<funapp>
<name>revconsapp</name>
<arg>
<funapp>
<name>N</name>
</funapp>
</arg>
<arg>
<var>r</var>
</arg>
</funapp>
</lhs>
<rhs>
<var>r</var>
</rhs>
</rule>
<rule>
<lhs>
<funapp>
<name>deeprev</name>
<arg>
<funapp>
<name>C</name>
<arg>
<var>x1</var>
</arg>
<arg>
<var>x2</var>
</arg>
</funapp>
</arg>
</funapp>
</lhs>
<rhs>
<funapp>
<name>deeprevapp</name>
<arg>
<funapp>
<name>C</name>
<arg>
<var>x1</var>
</arg>
<arg>
<var>x2</var>
</arg>
</funapp>
</arg>
<arg>
<funapp>
<name>N</name>
</funapp>
</arg>
</funapp>
</rhs>
</rule>
<rule>
<lhs>
<funapp>
<name>deeprev</name>
<arg>
<funapp>
<name>V</name>
<arg>
<var>n</var>
</arg>
</funapp>
</arg>
</funapp>
</lhs>
<rhs>
<funapp>
<name>V</name>
<arg>
<var>n</var>
</arg>
</funapp>
</rhs>
</rule>
<rule>
<lhs>
<funapp>
<name>deeprev</name>
<arg>
<funapp>
<name>N</name>
</funapp>
</arg>
</funapp>
</lhs>
<rhs>
<funapp>
<name>N</name>
</funapp>
</rhs>
</rule>
<rule>
<lhs>
<funapp>
<name>second</name>
<arg>
<funapp>
<name>V</name>
<arg>
<var>n</var>
</arg>
</funapp>
</arg>
</funapp>
</lhs>
<rhs>
<funapp>
<name>N</name>
</funapp>
</rhs>
</rule>
<rule>
<lhs>
<funapp>
<name>second</name>
<arg>
<funapp>
<name>C</name>
<arg>
<var>x1</var>
</arg>
<arg>
<var>x2</var>
</arg>
</funapp>
</arg>
</funapp>
</lhs>
<rhs>
<var>x2</var>
</rhs>
</rule>
<rule>
<lhs>
<funapp>
<name>isVal</name>
<arg>
<funapp>
<name>C</name>
<arg>
<var>x1</var>
</arg>
<arg>
<var>x2</var>
</arg>
</funapp>
</arg>
</funapp>
</lhs>
<rhs>
<funapp>
<name>False</name>
</funapp>
</rhs>
</rule>
<rule>
<lhs>
<funapp>
<name>isVal</name>
<arg>
<funapp>
<name>V</name>
<arg>
<var>n</var>
</arg>
</funapp>
</arg>
</funapp>
</lhs>
<rhs>
<funapp>
<name>True</name>
</funapp>
</rhs>
</rule>
<rule>
<lhs>
<funapp>
<name>isVal</name>
<arg>
<funapp>
<name>N</name>
</funapp>
</arg>
</funapp>
</lhs>
<rhs>
<funapp>
<name>False</name>
</funapp>
</rhs>
</rule>
<rule>
<lhs>
<funapp>
<name>isNotEmptyT</name>
<arg>
<funapp>
<name>C</name>
<arg>
<var>x1</var>
</arg>
<arg>
<var>x2</var>
</arg>
</funapp>
</arg>
</funapp>
</lhs>
<rhs>
<funapp>
<name>True</name>
</funapp>
</rhs>
</rule>
<rule>
<lhs>
<funapp>
<name>isNotEmptyT</name>
<arg>
<funapp>
<name>V</name>
<arg>
<var>n</var>
</arg>
</funapp>
</arg>
</funapp>
</lhs>
<rhs>
<funapp>
<name>False</name>
</funapp>
</rhs>
</rule>
<rule>
<lhs>
<funapp>
<name>isNotEmptyT</name>
<arg>
<funapp>
<name>N</name>
</funapp>
</arg>
</funapp>
</lhs>
<rhs>
<funapp>
<name>False</name>
</funapp>
</rhs>
</rule>
<rule>
<lhs>
<funapp>
<name>isEmptyT</name>
<arg>
<funapp>
<name>C</name>
<arg>
<var>x1</var>
</arg>
<arg>
<var>x2</var>
</arg>
</funapp>
</arg>
</funapp>
</lhs>
<rhs>
<funapp>
<name>False</name>
</funapp>
</rhs>
</rule>
<rule>
<lhs>
<funapp>
<name>isEmptyT</name>
<arg>
<funapp>
<name>V</name>
<arg>
<var>n</var>
</arg>
</funapp>
</arg>
</funapp>
</lhs>
<rhs>
<funapp>
<name>False</name>
</funapp>
</rhs>
</rule>
<rule>
<lhs>
<funapp>
<name>isEmptyT</name>
<arg>
<funapp>
<name>N</name>
</funapp>
</arg>
</funapp>
</lhs>
<rhs>
<funapp>
<name>True</name>
</funapp>
</rhs>
</rule>
<rule>
<lhs>
<funapp>
<name>first</name>
<arg>
<funapp>
<name>V</name>
<arg>
<var>n</var>
</arg>
</funapp>
</arg>
</funapp>
</lhs>
<rhs>
<funapp>
<name>N</name>
</funapp>
</rhs>
</rule>
<rule>
<lhs>
<funapp>
<name>first</name>
<arg>
<funapp>
<name>C</name>
<arg>
<var>x1</var>
</arg>
<arg>
<var>x2</var>
</arg>
</funapp>
</arg>
</funapp>
</lhs>
<rhs>
<var>x1</var>
</rhs>
</rule>
<rule>
<lhs>
<funapp>
<name>goal</name>
<arg>
<var>x</var>
</arg>
</funapp>
</lhs>
<rhs>
<funapp>
<name>deeprev</name>
<arg>
<var>x</var>
</arg>
</funapp>
</rhs>
</rule>
</rules>
<signature>
<funcsym>
<name>revconsapp</name>
<arity>2</arity>
</funcsym>
<funcsym>
<name>C</name>
<arity>2</arity>
</funcsym>
<funcsym>
<name>deeprevapp</name>
<arity>2</arity>
</funcsym>
<funcsym>
<name>V</name>
<arity>1</arity>
</funcsym>
<funcsym>
<name>N</name>
<arity>0</arity>
</funcsym>
<funcsym>
<name>deeprev</name>
<arity>1</arity>
</funcsym>
<funcsym>
<name>second</name>
<arity>1</arity>
</funcsym>
<funcsym>
<name>isVal</name>
<arity>1</arity>
</funcsym>
<funcsym>
<name>False</name>
<arity>0</arity>
</funcsym>
<funcsym>
<name>True</name>
<arity>0</arity>
</funcsym>
<funcsym>
<name>isNotEmptyT</name>
<arity>1</arity>
</funcsym>
<funcsym>
<name>isEmptyT</name>
<arity>1</arity>
</funcsym>
<funcsym>
<name>first</name>
<arity>1</arity>
</funcsym>
<funcsym>
<name>goal</name>
<arity>1</arity>
</funcsym>
</signature>
</trs>
<strategy>INNERMOST</strategy>
<startterm>
<constructor-based/>
</startterm>
</problem>
