<?xml version="1.0"?>
<?xml-stylesheet type="text/xsl" href="../../xml/xtcHTML.xsl"?>
<problem xmlns:xsi="http://www.w3.org/2001/XMLSchema-instance" xsi:noNamespaceSchemaLocation="../../xml/xtc.xsd" type="termination">
<trs>
<rules>
<rule>
<lhs>
<funapp>
<name>ack</name>
<arg>
<funapp>
<name>0</name>
</funapp>
</arg>
<arg>
<var>X</var>
</arg>
</funapp>
</lhs>
<rhs>
<funapp>
<name>succ</name>
<arg>
<var>X</var>
</arg>
</funapp>
</rhs>
</rule>
<rule>
<lhs>
<funapp>
<name>ack</name>
<arg>
<funapp>
<name>succ</name>
<arg>
<var>Y</var>
</arg>
</funapp>
</arg>
<arg>
<var>U</var>
</arg>
</funapp>
</lhs>
<rhs>
<funapp>
<name>ack</name>
<arg>
<var>Y</var>
</arg>
<arg>
<funapp>
<name>succ</name>
<arg>
<funapp>
<name>0</name>
</funapp>
</arg>
</funapp>
</arg>
</funapp>
</rhs>
</rule>
<rule>
<lhs>
<funapp>
<name>ack</name>
<arg>
<funapp>
<name>succ</name>
<arg>
<var>V</var>
</arg>
</funapp>
</arg>
<arg>
<funapp>
<name>succ</name>
<arg>
<var>W</var>
</arg>
</funapp>
</arg>
</funapp>
</lhs>
<rhs>
<funapp>
<name>ack</name>
<arg>
<var>V</var>
</arg>
<arg>
<funapp>
<name>ack</name>
<arg>
<funapp>
<name>succ</name>
<arg>
<var>V</var>
</arg>
</funapp>
</arg>
<arg>
<var>W</var>
</arg>
</funapp>
</arg>
</funapp>
</rhs>
</rule>
<rule>
<lhs>
<funapp>
<name>map</name>
<arg>
<var>J</var>
</arg>
<arg>
<funapp>
<name>nil</name>
</funapp>
</arg>
</funapp>
</lhs>
<rhs>
<funapp>
<name>nil</name>
</funapp>
</rhs>
</rule>
<rule>
<lhs>
<funapp>
<name>map</name>
<arg>
<var>F1</var>
</arg>
<arg>
<funapp>
<name>cons</name>
<arg>
<var>Y1</var>
</arg>
<arg>
<var>U1</var>
</arg>
</funapp>
</arg>
</funapp>
</lhs>
<rhs>
<funapp>
<name>cons</name>
<arg>
<application>
<var>F1</var>
<var>Y1</var>
</application>
</arg>
<arg>
<funapp>
<name>map</name>
<arg>
<var>F1</var>
</arg>
<arg>
<var>U1</var>
</arg>
</funapp>
</arg>
</funapp>
</rhs>
</rule>
<rule>
<lhs>
<funapp>
<name>filter</name>
<arg>
<var>H1</var>
</arg>
<arg>
<funapp>
<name>nil</name>
</funapp>
</arg>
</funapp>
</lhs>
<rhs>
<funapp>
<name>nil</name>
</funapp>
</rhs>
</rule>
<rule>
<lhs>
<funapp>
<name>filter</name>
<arg>
<var>I1</var>
</arg>
<arg>
<funapp>
<name>cons</name>
<arg>
<var>P1</var>
</arg>
<arg>
<var>X2</var>
</arg>
</funapp>
</arg>
</funapp>
</lhs>
<rhs>
<funapp>
<name>filter2</name>
<arg>
<application>
<var>I1</var>
<var>P1</var>
</application>
</arg>
<arg>
<var>I1</var>
</arg>
<arg>
<var>P1</var>
</arg>
<arg>
<var>X2</var>
</arg>
</funapp>
</rhs>
</rule>
<rule>
<lhs>
<funapp>
<name>filter2</name>
<arg>
<funapp>
<name>true</name>
</funapp>
</arg>
<arg>
<var>Z2</var>
</arg>
<arg>
<var>U2</var>
</arg>
<arg>
<var>V2</var>
</arg>
</funapp>
</lhs>
<rhs>
<funapp>
<name>cons</name>
<arg>
<var>U2</var>
</arg>
<arg>
<funapp>
<name>filter</name>
<arg>
<var>Z2</var>
</arg>
<arg>
<var>V2</var>
</arg>
</funapp>
</arg>
</funapp>
</rhs>
</rule>
<rule>
<lhs>
<funapp>
<name>filter2</name>
<arg>
<funapp>
<name>false</name>
</funapp>
</arg>
<arg>
<var>I2</var>
</arg>
<arg>
<var>P2</var>
</arg>
<arg>
<var>X3</var>
</arg>
</funapp>
</lhs>
<rhs>
<funapp>
<name>filter</name>
<arg>
<var>I2</var>
</arg>
<arg>
<var>X3</var>
</arg>
</funapp>
</rhs>
</rule>
</rules>
<higherOrderSignature>
<variableTypeInfo>
<varDeclaration>
<var>X</var>
<type>
<basic>a</basic>
</type>
</varDeclaration>
<varDeclaration>
<var>Y</var>
<type>
<basic>a</basic>
</type>
</varDeclaration>
<varDeclaration>
<var>U</var>
<type>
<basic>a</basic>
</type>
</varDeclaration>
<varDeclaration>
<var>V</var>
<type>
<basic>a</basic>
</type>
</varDeclaration>
<varDeclaration>
<var>W</var>
<type>
<basic>a</basic>
</type>
</varDeclaration>
<varDeclaration>
<var>J</var>
<type>
<arrow>
<type>
<basic>c</basic>
</type>
<type>
<basic>c</basic>
</type>
</arrow>
</type>
</varDeclaration>
<varDeclaration>
<var>F1</var>
<type>
<arrow>
<type>
<basic>c</basic>
</type>
<type>
<basic>c</basic>
</type>
</arrow>
</type>
</varDeclaration>
<varDeclaration>
<var>Y1</var>
<type>
<basic>c</basic>
</type>
</varDeclaration>
<varDeclaration>
<var>U1</var>
<type>
<basic>d</basic>
</type>
</varDeclaration>
<varDeclaration>
<var>H1</var>
<type>
<arrow>
<type>
<basic>c</basic>
</type>
<type>
<basic>b</basic>
</type>
</arrow>
</type>
</varDeclaration>
<varDeclaration>
<var>I1</var>
<type>
<arrow>
<type>
<basic>c</basic>
</type>
<type>
<basic>b</basic>
</type>
</arrow>
</type>
</varDeclaration>
<varDeclaration>
<var>P1</var>
<type>
<basic>c</basic>
</type>
</varDeclaration>
<varDeclaration>
<var>X2</var>
<type>
<basic>d</basic>
</type>
</varDeclaration>
<varDeclaration>
<var>Z2</var>
<type>
<arrow>
<type>
<basic>c</basic>
</type>
<type>
<basic>b</basic>
</type>
</arrow>
</type>
</varDeclaration>
<varDeclaration>
<var>U2</var>
<type>
<basic>c</basic>
</type>
</varDeclaration>
<varDeclaration>
<var>V2</var>
<type>
<basic>d</basic>
</type>
</varDeclaration>
<varDeclaration>
<var>I2</var>
<type>
<arrow>
<type>
<basic>c</basic>
</type>
<type>
<basic>b</basic>
</type>
</arrow>
</type>
</varDeclaration>
<varDeclaration>
<var>P2</var>
<type>
<basic>c</basic>
</type>
</varDeclaration>
<varDeclaration>
<var>X3</var>
<type>
<basic>d</basic>
</type>
</varDeclaration>
</variableTypeInfo>
<functionSymbolTypeInfo>
<funcDeclaration>
<name>0</name>
<typeDeclaration>
<type>
<basic>a</basic>
</type>
</typeDeclaration>
</funcDeclaration>
<funcDeclaration>
<name>ack</name>
<typeDeclaration>
<type>
<basic>a</basic>
</type>
<type>
<basic>a</basic>
</type>
<type>
<basic>a</basic>
</type>
</typeDeclaration>
</funcDeclaration>
<funcDeclaration>
<name>cons</name>
<typeDeclaration>
<type>
<basic>c</basic>
</type>
<type>
<basic>d</basic>
</type>
<type>
<basic>d</basic>
</type>
</typeDeclaration>
</funcDeclaration>
<funcDeclaration>
<name>false</name>
<typeDeclaration>
<type>
<basic>b</basic>
</type>
</typeDeclaration>
</funcDeclaration>
<funcDeclaration>
<name>filter</name>
<typeDeclaration>
<type>
<arrow>
<type>
<basic>c</basic>
</type>
<type>
<basic>b</basic>
</type>
</arrow>
</type>
<type>
<basic>d</basic>
</type>
<type>
<basic>d</basic>
</type>
</typeDeclaration>
</funcDeclaration>
<funcDeclaration>
<name>filter2</name>
<typeDeclaration>
<type>
<basic>b</basic>
</type>
<type>
<arrow>
<type>
<basic>c</basic>
</type>
<type>
<basic>b</basic>
</type>
</arrow>
</type>
<type>
<basic>c</basic>
</type>
<type>
<basic>d</basic>
</type>
<type>
<basic>d</basic>
</type>
</typeDeclaration>
</funcDeclaration>
<funcDeclaration>
<name>map</name>
<typeDeclaration>
<type>
<arrow>
<type>
<basic>c</basic>
</type>
<type>
<basic>c</basic>
</type>
</arrow>
</type>
<type>
<basic>d</basic>
</type>
<type>
<basic>d</basic>
</type>
</typeDeclaration>
</funcDeclaration>
<funcDeclaration>
<name>nil</name>
<typeDeclaration>
<type>
<basic>d</basic>
</type>
</typeDeclaration>
</funcDeclaration>
<funcDeclaration>
<name>succ</name>
<typeDeclaration>
<type>
<basic>a</basic>
</type>
<type>
<basic>a</basic>
</type>
</typeDeclaration>
</funcDeclaration>
<funcDeclaration>
<name>true</name>
<typeDeclaration>
<type>
<basic>b</basic>
</type>
</typeDeclaration>
</funcDeclaration>
</functionSymbolTypeInfo>
</higherOrderSignature>
</trs>
<strategy>FULL</strategy>
<metainformation>
<originalfilename>benchmarks/applicative/Applicative_first_order_05__29.atrs</originalfilename>
</metainformation>
</problem>
