<?xml version="1.0"?>
<?xml-stylesheet type="text/xsl" href="../../xml/xtcHTML.xsl"?>
<problem xmlns:xsi="http://www.w3.org/2001/XMLSchema-instance" xsi:noNamespaceSchemaLocation="../../xml/xtc.xsd" type="termination">
<trs>
<rules>
<rule>
<lhs>
<funapp>
<name>rec</name>
<arg>
<var>X</var>
</arg>
<arg>
<var>Z</var>
</arg>
<arg>
<var>G</var>
</arg>
<arg>
<funapp>
<name>0</name>
</funapp>
</arg>
</funapp>
</lhs>
<rhs>
<var>X</var>
</rhs>
</rule>
<rule>
<lhs>
<funapp>
<name>rec</name>
<arg>
<var>V</var>
</arg>
<arg>
<var>I</var>
</arg>
<arg>
<var>J</var>
</arg>
<arg>
<funapp>
<name>s</name>
<arg>
<var>X1</var>
</arg>
</funapp>
</arg>
</funapp>
</lhs>
<rhs>
<application>
<application>
<var>I</var>
<var>X1</var>
</application>
<funapp>
<name>rec</name>
<arg>
<var>V</var>
</arg>
<arg>
<var>I</var>
</arg>
<arg>
<var>J</var>
</arg>
<arg>
<var>X1</var>
</arg>
</funapp>
</application>
</rhs>
</rule>
<rule>
<lhs>
<funapp>
<name>rec</name>
<arg>
<var>U1</var>
</arg>
<arg>
<var>H1</var>
</arg>
<arg>
<var>I1</var>
</arg>
<arg>
<funapp>
<name>lim</name>
<arg>
<var>Z1</var>
</arg>
</funapp>
</arg>
</funapp>
</lhs>
<rhs>
<application>
<application>
<var>I1</var>
<var>Z1</var>
</application>
<funapp>
<name>rectuv</name>
<arg>
<var>U1</var>
</arg>
<arg>
<var>H1</var>
</arg>
<arg>
<var>I1</var>
</arg>
<arg>
<application>
<var>Z1</var>
<funapp>
<name>n</name>
</funapp>
</application>
</arg>
</funapp>
</application>
</rhs>
</rule>
<rule>
<lhs>
<funapp>
<name>rectuv</name>
<arg>
<var>P1</var>
</arg>
<arg>
<var>F2</var>
</arg>
<arg>
<var>Z2</var>
</arg>
<arg>
<funapp>
<name>n</name>
</funapp>
</arg>
</funapp>
</lhs>
<rhs>
<funapp>
<name>rec</name>
<arg>
<var>P1</var>
</arg>
<arg>
<var>F2</var>
</arg>
<arg>
<var>Z2</var>
</arg>
<arg>
<funapp>
<name>n</name>
</funapp>
</arg>
</funapp>
</rhs>
</rule>
</rules>
<higherOrderSignature>
<variableTypeInfo>
<varDeclaration>
<var>X</var>
<type>
<basic>b</basic>
</type>
</varDeclaration>
<varDeclaration>
<var>Z</var>
<type>
<arrow>
<type>
<basic>a</basic>
</type>
<type>
<arrow>
<type>
<basic>b</basic>
</type>
<type>
<basic>b</basic>
</type>
</arrow>
</type>
</arrow>
</type>
</varDeclaration>
<varDeclaration>
<var>G</var>
<type>
<arrow>
<type>
<arrow>
<type>
<basic>a</basic>
</type>
<type>
<basic>a</basic>
</type>
</arrow>
</type>
<type>
<arrow>
<type>
<basic>b</basic>
</type>
<type>
<basic>b</basic>
</type>
</arrow>
</type>
</arrow>
</type>
</varDeclaration>
<varDeclaration>
<var>V</var>
<type>
<basic>b</basic>
</type>
</varDeclaration>
<varDeclaration>
<var>I</var>
<type>
<arrow>
<type>
<basic>a</basic>
</type>
<type>
<arrow>
<type>
<basic>b</basic>
</type>
<type>
<basic>b</basic>
</type>
</arrow>
</type>
</arrow>
</type>
</varDeclaration>
<varDeclaration>
<var>J</var>
<type>
<arrow>
<type>
<arrow>
<type>
<basic>a</basic>
</type>
<type>
<basic>a</basic>
</type>
</arrow>
</type>
<type>
<arrow>
<type>
<basic>b</basic>
</type>
<type>
<basic>b</basic>
</type>
</arrow>
</type>
</arrow>
</type>
</varDeclaration>
<varDeclaration>
<var>X1</var>
<type>
<basic>a</basic>
</type>
</varDeclaration>
<varDeclaration>
<var>Z1</var>
<type>
<arrow>
<type>
<basic>a</basic>
</type>
<type>
<basic>a</basic>
</type>
</arrow>
</type>
</varDeclaration>
<varDeclaration>
<var>U1</var>
<type>
<basic>b</basic>
</type>
</varDeclaration>
<varDeclaration>
<var>H1</var>
<type>
<arrow>
<type>
<basic>a</basic>
</type>
<type>
<arrow>
<type>
<basic>b</basic>
</type>
<type>
<basic>b</basic>
</type>
</arrow>
</type>
</arrow>
</type>
</varDeclaration>
<varDeclaration>
<var>I1</var>
<type>
<arrow>
<type>
<arrow>
<type>
<basic>a</basic>
</type>
<type>
<basic>a</basic>
</type>
</arrow>
</type>
<type>
<arrow>
<type>
<basic>b</basic>
</type>
<type>
<basic>b</basic>
</type>
</arrow>
</type>
</arrow>
</type>
</varDeclaration>
<varDeclaration>
<var>P1</var>
<type>
<basic>b</basic>
</type>
</varDeclaration>
<varDeclaration>
<var>F2</var>
<type>
<arrow>
<type>
<basic>a</basic>
</type>
<type>
<arrow>
<type>
<basic>b</basic>
</type>
<type>
<basic>b</basic>
</type>
</arrow>
</type>
</arrow>
</type>
</varDeclaration>
<varDeclaration>
<var>Z2</var>
<type>
<arrow>
<type>
<arrow>
<type>
<basic>a</basic>
</type>
<type>
<basic>a</basic>
</type>
</arrow>
</type>
<type>
<arrow>
<type>
<basic>b</basic>
</type>
<type>
<basic>b</basic>
</type>
</arrow>
</type>
</arrow>
</type>
</varDeclaration>
</variableTypeInfo>
<functionSymbolTypeInfo>
<funcDeclaration>
<name>0</name>
<typeDeclaration>
<type>
<basic>a</basic>
</type>
</typeDeclaration>
</funcDeclaration>
<funcDeclaration>
<name>lim</name>
<typeDeclaration>
<type>
<arrow>
<type>
<basic>a</basic>
</type>
<type>
<basic>a</basic>
</type>
</arrow>
</type>
<type>
<basic>a</basic>
</type>
</typeDeclaration>
</funcDeclaration>
<funcDeclaration>
<name>n</name>
<typeDeclaration>
<type>
<basic>a</basic>
</type>
</typeDeclaration>
</funcDeclaration>
<funcDeclaration>
<name>rec</name>
<typeDeclaration>
<type>
<basic>b</basic>
</type>
<type>
<arrow>
<type>
<basic>a</basic>
</type>
<type>
<arrow>
<type>
<basic>b</basic>
</type>
<type>
<basic>b</basic>
</type>
</arrow>
</type>
</arrow>
</type>
<type>
<arrow>
<type>
<arrow>
<type>
<basic>a</basic>
</type>
<type>
<basic>a</basic>
</type>
</arrow>
</type>
<type>
<arrow>
<type>
<basic>b</basic>
</type>
<type>
<basic>b</basic>
</type>
</arrow>
</type>
</arrow>
</type>
<type>
<basic>a</basic>
</type>
<type>
<basic>b</basic>
</type>
</typeDeclaration>
</funcDeclaration>
<funcDeclaration>
<name>rectuv</name>
<typeDeclaration>
<type>
<basic>b</basic>
</type>
<type>
<arrow>
<type>
<basic>a</basic>
</type>
<type>
<arrow>
<type>
<basic>b</basic>
</type>
<type>
<basic>b</basic>
</type>
</arrow>
</type>
</arrow>
</type>
<type>
<arrow>
<type>
<arrow>
<type>
<basic>a</basic>
</type>
<type>
<basic>a</basic>
</type>
</arrow>
</type>
<type>
<arrow>
<type>
<basic>b</basic>
</type>
<type>
<basic>b</basic>
</type>
</arrow>
</type>
</arrow>
</type>
<type>
<basic>a</basic>
</type>
<type>
<basic>b</basic>
</type>
</typeDeclaration>
</funcDeclaration>
<funcDeclaration>
<name>s</name>
<typeDeclaration>
<type>
<basic>a</basic>
</type>
<type>
<basic>a</basic>
</type>
</typeDeclaration>
</funcDeclaration>
</functionSymbolTypeInfo>
</higherOrderSignature>
</trs>
<strategy>FULL</strategy>
<metainformation>
<originalfilename>benchmarks/applicative/Applicative_05__Ex7OrdinalRec.atrs</originalfilename>
</metainformation>
</problem>
